Microsoft Windows [Version 10.0.26100.4770]
(c) Microsoft Corporation. All rights reserved.

C:\Program Files\MySQL\MySQL Server 8.0\bin>mysql -u root -p
Enter password: **********
Welcome to the MySQL monitor.  Commands end with ; or \g.
Your MySQL connection id is 30
Server version: 8.0.43 MySQL Community Server - GPL

Copyright (c) 2000, 2025, Oracle and/or its affiliates.

Oracle is a registered trademark of Oracle Corporation and/or its
affiliates. Other names may be trademarks of their respective
owners.

Type 'help;' or '\h' for help. Type '\c' to clear the current input statement.

mysql> show databases;
+--------------------+
| Database           |
+--------------------+
| company            |
| ecommerce          |
| information_schema |
| mysql              |
| performance_schema |
| sakila             |
| school             |
| student            |
| sys                |
| world              |
+--------------------+
10 rows in set (0.02 sec)

mysql> use school;
Database changed
mysql> CREATE TABLE college ( roll_no INT PRIMARY KEY,
    -> name VARCHAR(100),
    -> course VARCHAR(100),
    -> class VARCHAR(100),
    -> fees DECIMAL(10,2)
    -> );
Query OK, 0 rows affected (0.06 sec)

mysql> desc college;
+---------+---------------+------+-----+---------+-------+
| Field   | Type          | Null | Key | Default | Extra |
+---------+---------------+------+-----+---------+-------+
| roll_no | int           | NO   | PRI | NULL    |       |
| name    | varchar(100)  | YES  |     | NULL    |       |
| course  | varchar(100)  | YES  |     | NULL    |       |
| class   | varchar(100)  | YES  |     | NULL    |       |
| fees    | decimal(10,2) | YES  |     | NULL    |       |
+---------+---------------+------+-----+---------+-------+
5 rows in set (0.03 sec)

mysql> INSERT INTO college (roll_no, name, course, class, fees)
    -> VALUES
    -> (1, 'dolly','computer science', 'be',40000),
    ->  (2, 'rushi','AIDS', 'te',50000),
    ->  (3, 'soham','civil engi', 'se',30000);
Query OK, 3 rows affected (0.02 sec)
Records: 3  Duplicates: 0  Warnings: 0

mysql> SELECT * FROM college;
+---------+-------+------------------+-------+----------+
| roll_no | name  | course           | class | fees     |
+---------+-------+------------------+-------+----------+
|       1 | dolly | computer science | be    | 40000.00 |
|       2 | rushi | AIDS             | te    | 50000.00 |
|       3 | soham | civil engi       | se    | 30000.00 |
+---------+-------+------------------+-------+----------+
3 rows in set (0.00 sec)

mysql> UPDATE college
    -> SET fees = fees + 10000 WHERE class = 'be';
Query OK, 1 row affected (0.02 sec)
Rows matched: 1  Changed: 1  Warnings: 0

mysql> SELECT fees + 10000 AS updated_fees FROM college
    -> WHERE class = 'be';
+--------------+
| updated_fees |
+--------------+
|     60000.00 |
+--------------+
1 row in set (0.00 sec)

mysql> SELECT * FROM college;
+---------+-------+------------------+-------+----------+
| roll_no | name  | course           | class | fees     |
+---------+-------+------------------+-------+----------+
|       1 | dolly | computer science | be    | 50000.00 |
|       2 | rushi | AIDS             | te    | 50000.00 |
|       3 | soham | civil engi       | se    | 30000.00 |
+---------+-------+------------------+-------+----------+
3 rows in set (0.00 sec)

mysql> UPDATE college
    -> SET fees = fees  - 10000 WHERE class = 'AIDS';
Query OK, 0 rows affected (0.00 sec)
Rows matched: 0  Changed: 0  Warnings: 0

mysql> SELECT fees - 10000 AS updated_fees FROM college
    -> WHERE class = 'AIDS';
Empty set (0.00 sec)

mysql> SELECT * FROM college;
+---------+-------+------------------+-------+----------+
| roll_no | name  | course           | class | fees     |
+---------+-------+------------------+-------+----------+
|       1 | dolly | computer science | be    | 50000.00 |
|       2 | rushi | AIDS             | te    | 50000.00 |
|       3 | soham | civil engi       | se    | 30000.00 |
+---------+-------+------------------+-------+----------+
3 rows in set (0.00 sec)

mysql> UPDATE: Multiply fees by 2 where class is 'be'
    -> -- UPDATE: Multiply fees by 2 where class is 'be'
    ->
    -> -- UPDATE: Multiply fees by 2 where class is 'be'
    -> UPDATE college
    -> SET fees = fees * 2
    -> WHERE class = 'be';
ERROR 1064 (42000): You have an error in your SQL syntax; check the manual that corresponds to your MySQL server version for the right syntax to use near ': Multiply fees by 2 where class is 'be'



UPDATE college
SET fees = fees * 2
W' at line 1
mysql> Multiply fees by 2 where class is 'te'
    ->  UPDATE college
    -> SET fees = fees * 2
    ->  WHERE class = 'te';
ERROR 1064 (42000): You have an error in your SQL syntax; check the manual that corresponds to your MySQL server version for the right syntax to use near 'Multiply fees by 2 where class is 'te'
 UPDATE college
SET fees = fees * 2
 WHER' at line 1
mysql> SELECT * FROM college;
+---------+-------+------------------+-------+----------+
| roll_no | name  | course           | class | fees     |
+---------+-------+------------------+-------+----------+
|       1 | dolly | computer science | be    | 50000.00 |
|       2 | rushi | AIDS             | te    | 50000.00 |
|       3 | soham | civil engi       | se    | 30000.00 |
+---------+-------+------------------+-------+----------+
3 rows in set (0.00 sec)

mysql> UPDATE: Divide fees by 10 where class is 'be'
    -> -- UPDATE: Divide fees by 10 where class is 'be'
    -> UPDATE college
    -> SET fees = fees / 10
    -> WHERE class = 'be';
ERROR 1064 (42000): You have an error in your SQL syntax; check the manual that corresponds to your MySQL server version for the right syntax to use near ': Divide fees by 10 where class is 'be'

UPDATE college
SET fees = fees / 10
WHE' at line 1
mysql> UPDATE college
    -> SET fees = fees / 10
    -> WHERE class = 'be';
Query OK, 1 row affected (0.02 sec)
Rows matched: 1  Changed: 1  Warnings: 0

mysql> SELECT: Show fees divided by 10
    -> SELECT fees / 10 AS updated_fees
    -> ^C
mysql>  FROM college
    -> WHERE class = 'be';
ERROR 1064 (42000): You have an error in your SQL syntax; check the manual that corresponds to your MySQL server version for the right syntax to use near 'FROM college
WHERE class = 'be'' at line 1
mysql> SELECT * FROM college WHERE class = 'be';
+---------+-------+------------------+-------+---------+
| roll_no | name  | course           | class | fees    |
+---------+-------+------------------+-------+---------+
|       1 | dolly | computer science | be    | 5000.00 |
+---------+-------+------------------+-------+---------+
1 row in set (0.00 sec)

mysql> SELECT * FROM college;
+---------+-------+------------------+-------+----------+
| roll_no | name  | course           | class | fees     |
+---------+-------+------------------+-------+----------+
|       1 | dolly | computer science | be    |  5000.00 |
|       2 | rushi | AIDS             | te    | 50000.00 |
|       3 | soham | civil engi       | se    | 30000.00 |
+---------+-------+------------------+-------+----------+
3 rows in set (0.00 sec)

mysql> UPDATE: Set fees as remainder when divided by 3 where class is 'be'
    -> UPDATE: Set fees as remainder when divided by 3 where class is 'be'
    -> UPDATE college
    -> SET fees = fees % 3
    -> WHERE class = 'be';
ERROR 1064 (42000): You have an error in your SQL syntax; check the manual that corresponds to your MySQL server version for the right syntax to use near ': Set fees as remainder when divided by 3 where class is 'be'
UPDATE: Set fees a' at line 1
mysql> UPDATE college
    -> SET fees = fees % 3
    -> WHERE class = 'be';
Query OK, 1 row affected (0.02 sec)
Rows matched: 1  Changed: 1  Warnings: 0

mysql> SELECT: Show fees modulo 3
    -> SELECT fees % 3 AS updated_fees
    -> FROM college
    -> WHERE class = 'be';
ERROR 1064 (42000): You have an error in your SQL syntax; check the manual that corresponds to your MySQL server version for the right syntax to use near ': Show fees modulo 3
SELECT fees % 3 AS updated_fees
FROM college
WHERE class = ' at line 1
mysql> SELECT fees % 3 AS updated_fees
    -> FROM college
    -> WHERE class = 'be';
+--------------+
| updated_fees |
+--------------+
|         2.00 |
+--------------+
1 row in set (0.00 sec)

mysql> SELECT * FROM college;
+---------+-------+------------------+-------+----------+
| roll_no | name  | course           | class | fees     |
+---------+-------+------------------+-------+----------+
|       1 | dolly | computer science | be    |     2.00 |
|       2 | rushi | AIDS             | te    | 50000.00 |
|       3 | soham | civil engi       | se    | 30000.00 |
+---------+-------+------------------+-------+----------+
3 rows in set (0.00 sec)

mysql> CREATE INDEX vedant ON college(name);
Query OK, 0 rows affected (0.10 sec)
Records: 0  Duplicates: 0  Warnings: 0

mysql> CREATE UNIQUE INDEX college_unique_index ON college(name, course);
Query OK, 0 rows affected (0.07 sec)
Records: 0  Duplicates: 0  Warnings: 0

mysql> DROP INDEX vedant ON college;
Query OK, 0 rows affected (0.04 sec)
Records: 0  Duplicates: 0  Warnings: 0

mysql> SHOW INDEX FROM college;
+---------+------------+----------------------+--------------+-------------+-----------+-------------+----------+--------+------+------------+---------+---------------+---------+------------+
| Table   | Non_unique | Key_name             | Seq_in_index | Column_name | Collation | Cardinality | Sub_part | Packed | Null | Index_type | Comment | Index_comment | Visible | Expression |
+---------+------------+----------------------+--------------+-------------+-----------+-------------+----------+--------+------+------------+---------+---------------+---------+------------+
| college |          0 | PRIMARY              |            1 | roll_no     | A         |           3 |     NULL |   NULL |      | BTREE      |         |               | YES     | NULL       |
| college |          0 | college_unique_index |            1 | name        | A         |           3 |     NULL |   NULL | YES  | BTREE      |         |               | YES     | NULL       |
| college |          0 | college_unique_index |            2 | course      | A         |           3 |     NULL |   NULL | YES  | BTREE      |         |               | YES     | NULL       |
+---------+------------+----------------------+--------------+-------------+-----------+-------------+----------+--------+------+------------+---------+---------------+---------+------------+
3 rows in set (0.04 sec)

mysql>
